{
  "$schema": "https://json-schema.org/draft/2020-12/schema",
  "$id": "https://hammertime.dev/schemas/detection_config.v1.json",
  "title": "DetectionConfig",
  "type": "object",
  "required": [
    "config_version", "window_seconds", "bucket_seconds",
    "hot_threshold", "cold_threshold", "minimum_hot_ips", "minimum_hot_ratio"
  ],
  "additionalProperties": false,
  "properties": {
    "config_version": { "type": "integer", "minimum": 1 },
    "window_seconds": { "type": "integer", "minimum": 1 },
    "bucket_seconds": { "type": "integer", "minimum": 1 },
    "hot_threshold": { "type": "integer", "minimum": 1 },
    "cold_threshold": { "type": "integer", "minimum": 0 },
    "minimum_hot_ips": { "type": "integer", "minimum": 1 },
    "minimum_hot_ratio": { "type": "number", "minimum": 0, "maximum": 1 },
    "allowed_lateness_seconds": { "type": "integer", "minimum": 0 },
    "state_retention_seconds": { "type": "integer", "minimum": 1 },
    "weight_function": {
      "enum": ["threshold_ratio"],
      "description": "Which function produces IpAttributes.weight at transition time (spec section 46, ADR-0005). Default \"threshold_ratio\". Adding a function is an enum entry plus a spec section 46 definition; the wire format does not change, because weight is always a fixed-point integer in thousandths of hot_threshold."
    },
    "weight_max": {
      "type": "integer",
      "minimum": 1000,
      "maximum": 1000000,
      "description": "Upper clamp applied to weight, in the same thousandths-of-hot_threshold units (1000 = exactly at hot_threshold). Default 1000000. Bounds what an extreme window count can write into a per-IP record."
    }
  }
}
